{
  "canonical_inputs": [
    "generated/skills/skill-registry.json",
    "generated/skills/command-registry.json"
  ],
  "generated_by": "tools/skills/build_scenario_packs.py",
  "pack_id": "scenario-packs",
  "scenarios": [
    {
      "applicable_repos": [
        "mereka-lms",
        "bbi-infrastructure",
        "platform-control-plane"
      ],
      "commands_to_run": [
        {
          "command": "bash scripts/promote.sh --help",
          "command_id": "promote-help",
          "repo": "bbi-infrastructure"
        },
        {
          "command": "bash scripts/promote.sh --dry-run",
          "command_id": "promote-dry-run",
          "repo": "bbi-infrastructure"
        },
        {
          "command": "./scripts/plan-all.sh --validate-only",
          "command_id": "platform-plan-validate",
          "repo": "platform-control-plane"
        },
        {
          "command": "bash tools/docs/verify/run-docs-world-class-gates.sh",
          "command_id": "docs-world-class-gates",
          "repo": "mereka-lms"
        }
      ],
      "escalation_points": [
        "canonical source missing or contradictory",
        "cross-repo disagreement not resolved by contracts",
        "required validator fails"
      ],
      "evidence_to_collect": [
        "release_contract",
        "workflow_dispatch",
        "release_obligations",
        "cross_repo_alignment",
        "release_notes_diff",
        "smoke_test_result",
        "rollback_target_reference"
      ],
      "expected_outputs": [
        "deterministic answer from canonical sources",
        "explicit reviewer and evidence path"
      ],
      "goal": "Resolve promotion semantics, obligations, and validation entrypoints before promotion.",
      "read_first": [
        {
          "path": "scripts/promote.sh",
          "repo": "bbi-infrastructure"
        },
        {
          "path": ".github/workflows/promote-image.yml",
          "repo": "bbi-infrastructure"
        },
        {
          "path": "config/domain-registry.yaml",
          "repo": "bbi-infrastructure"
        },
        {
          "path": "contracts/release-contracts.yaml",
          "repo": "platform-control-plane"
        },
        {
          "path": "contracts/service-identity-contract.yaml",
          "repo": "platform-control-plane"
        },
        {
          "path": "docs/meta/standing-orders/GOVERNANCE_AGENT.md",
          "repo": "mereka-lms"
        }
      ],
      "required_skills": [
        "promotion-workflow-review",
        "cross-repo-release-contract-review",
        "release-obligations-review"
      ],
      "reviewer_signoff_rules": [
        "release",
        "platform"
      ],
      "scenario_id": "promote-app-safely",
      "stop_conditions": [
        "required command missing",
        "required reviewer class unresolved",
        "archive or transitional path appears as canonical source"
      ],
      "title": "Can I promote this app safely?"
    },
    {
      "applicable_repos": [
        "mereka-lms",
        "bbi-infrastructure",
        "platform-control-plane"
      ],
      "commands_to_run": [
        {
          "command": "bash tools/docs/verify/verify-docs-policy.sh --range origin/main...HEAD",
          "command_id": "docs-policy-gate",
          "repo": "mereka-lms"
        },
        {
          "command": "python3 tools/docs/verify/verify-doc-catalog-governance.py --range origin/main...HEAD",
          "command_id": "docs-catalog-governance",
          "repo": "mereka-lms"
        },
        {
          "command": "./scripts/plan-all.sh --validate-only",
          "command_id": "platform-plan-validate",
          "repo": "platform-control-plane"
        },
        {
          "command": "bash tools/docs/verify/run-docs-world-class-gates.sh",
          "command_id": "docs-world-class-gates",
          "repo": "mereka-lms"
        }
      ],
      "escalation_points": [
        "canonical source missing or contradictory",
        "cross-repo disagreement not resolved by contracts",
        "required validator fails"
      ],
      "evidence_to_collect": [
        "docs_policy",
        "catalog_governance",
        "source_of_truth_map",
        "validation_run"
      ],
      "expected_outputs": [
        "deterministic answer from canonical sources",
        "explicit reviewer and evidence path"
      ],
      "goal": "Resolve the review path and truth owners for the current change set.",
      "read_first": [
        {
          "path": "docs/README.md",
          "repo": "mereka-lms"
        },
        {
          "path": "docs/architecture/PLATFORM_AUTHORITY_MAP.md",
          "repo": "mereka-lms"
        },
        {
          "path": "docs/meta/standing-orders/README.md",
          "repo": "mereka-lms"
        },
        {
          "path": "tools/docs/verify/verify-docs-policy.sh",
          "repo": "mereka-lms"
        },
        {
          "path": "tools/docs/verify/verify-doc-catalog-governance.py",
          "repo": "mereka-lms"
        },
        {
          "path": "config/bootstrap-lane-topology.yaml",
          "repo": "bbi-infrastructure"
        },
        {
          "path": "contracts/release-contracts.yaml",
          "repo": "platform-control-plane"
        },
        {
          "path": "tools/docs/verify/run-docs-world-class-gates.sh",
          "repo": "mereka-lms"
        },
        {
          "path": "scripts/promote.sh",
          "repo": "bbi-infrastructure"
        },
        {
          "path": "scripts/plan-all.sh",
          "repo": "platform-control-plane"
        }
      ],
      "required_skills": [
        "docs-truth-review",
        "change-impact-triage",
        "control-plane-validation"
      ],
      "reviewer_signoff_rules": [
        "docs",
        "platform"
      ],
      "scenario_id": "required-reviewers-for-diff",
      "stop_conditions": [
        "required command missing",
        "required reviewer class unresolved",
        "archive or transitional path appears as canonical source"
      ],
      "title": "What reviewers are required for this diff?"
    },
    {
      "applicable_repos": [
        "mereka-lms",
        "bbi-infrastructure",
        "platform-control-plane"
      ],
      "commands_to_run": [
        {
          "command": "bash tools/docs/verify/verify-docs-policy.sh --range origin/main...HEAD",
          "command_id": "docs-policy-gate",
          "repo": "mereka-lms"
        },
        {
          "command": "./scripts/plan-all.sh --validate-only",
          "command_id": "platform-plan-validate",
          "repo": "platform-control-plane"
        },
        {
          "command": "bash scripts/promote.sh --help",
          "command_id": "promote-help",
          "repo": "bbi-infrastructure"
        }
      ],
      "escalation_points": [
        "canonical source missing or contradictory",
        "cross-repo disagreement not resolved by contracts",
        "required validator fails"
      ],
      "evidence_to_collect": [
        "source_of_truth_map",
        "service_identity",
        "topology_contract"
      ],
      "expected_outputs": [
        "deterministic answer from canonical sources",
        "explicit reviewer and evidence path"
      ],
      "goal": "Determine the authoritative repo and canonical source for a truth surface.",
      "read_first": [
        {
          "path": "docs/architecture/PLATFORM_AUTHORITY_MAP.md",
          "repo": "mereka-lms"
        },
        {
          "path": "config/bootstrap-lane-topology.yaml",
          "repo": "bbi-infrastructure"
        },
        {
          "path": "contracts/release-contracts.yaml",
          "repo": "platform-control-plane"
        },
        {
          "path": "contracts/service-identity-contract.yaml",
          "repo": "platform-control-plane"
        },
        {
          "path": "config/domain-registry.yaml",
          "repo": "bbi-infrastructure"
        },
        {
          "path": "scripts/promote.sh",
          "repo": "bbi-infrastructure"
        }
      ],
      "required_skills": [
        "change-impact-triage",
        "service-identity-lookup",
        "topology-lookup"
      ],
      "reviewer_signoff_rules": [
        "platform"
      ],
      "scenario_id": "repo-ownership-of-truth",
      "stop_conditions": [
        "required command missing",
        "required reviewer class unresolved",
        "archive or transitional path appears as canonical source"
      ],
      "title": "Which repo owns this truth?"
    },
    {
      "applicable_repos": [
        "bbi-infrastructure",
        "platform-control-plane",
        "mereka-lms"
      ],
      "commands_to_run": [
        {
          "command": "./scripts/plan-all.sh --validate-only",
          "command_id": "platform-plan-validate",
          "repo": "platform-control-plane"
        },
        {
          "command": "bash tools/docs/verify/run-docs-world-class-gates.sh",
          "command_id": "docs-world-class-gates",
          "repo": "mereka-lms"
        },
        {
          "command": "bash tools/docs/verify/verify-docs-policy.sh --range origin/main...HEAD",
          "command_id": "docs-policy-gate",
          "repo": "mereka-lms"
        }
      ],
      "escalation_points": [
        "canonical source missing or contradictory",
        "cross-repo disagreement not resolved by contracts",
        "required validator fails"
      ],
      "evidence_to_collect": [
        "service_identity",
        "release_obligations",
        "cross_repo_alignment",
        "source_of_truth_map"
      ],
      "expected_outputs": [
        "deterministic answer from canonical sources",
        "explicit reviewer and evidence path"
      ],
      "goal": "Trace service identity fallout across release contracts, topology, and promotion workflow surfaces.",
      "read_first": [
        {
          "path": "contracts/service-identity-contract.yaml",
          "repo": "platform-control-plane"